[
  {
    "_comment": "示例：复制此对象并修改即可快速接入新官网（演示配置，请勿删除或改动本示例）",
    "company_id": "C002",
    "company_name": "示例公司",
    "detail_api": {
      "url": "https://example.com/api/detail",
      "default_params": {
        "language": "zh-cn"
      }
    },
    "extra": {
      "default_category_id": "CXXXDEFAULT",
      "field_map": {
        "bonus": "detail.bonus",
        "description": "detail.description",
        "education": "detail.education",
        "job_url": "detail.url",
        "location": "detail.city",
        "publish_time": "detail.publish_time",
        "requirement": "detail.requirement",
        "salary": "detail.salary",
        "title": "detail.title",
        "work_experience": "detail.experience"
      },
      "default_values": {
        "bonus": "NULL",
        "salary": "面议"
      },
      "list": {
        "category_param": null,
        "code_field": "status.code",
        "count_path": "total",
        "data_path": "data",
        "page_param": "page",
        "page_size": 20,
        "post_id_field": "id",
        "posts_path": "items",
        "size_param": "pageSize",
        "success_value": 0,
        "timestamp_param": null
      },
      "detail": {
        "code_field": "status.code",
        "data_path": "data",
        "success_value": 0
      },
      "headers": {
        "Authorization": "Bearer <token>"
      }
    },
    "list_api": {
      "url": "https://example.com/api/list",
      "default_params": {
        "area": "cn",
        "categoryId": "",
        "cityId": "",
        "countryId": "",
        "language": "zh-cn",
        "pageIndex": 1,
        "pageSize": 20
      }
    },
    "provider": "config",
    "throttle": {
      "max_retries": 5,
      "max_seconds": 2,
      "min_seconds": 1,
      "retry_backoff": 1.5,
      "timeout": 20
    }
  },
  {
    "company_id": "C001",
    "company_name": "Tencent",
    "detail_api": {
      "url": "https://careers.tencent.com/tencentcareer/api/post/ByPostId",
      "default_params": {
        "language": "zh-cn"
      }
    },
    "extra": {
      "field_map": {
        "bonus": "ImportantItem",
        "description": "Responsibility",
        "job_url": "PostURL",
        "location": "LocationName",
        "publish_time": "LastUpdateTime",
        "requirement": "Requirement",
        "title": "RecruitPostName",
        "work_experience": "RequireWorkYearsName"
      },
      "default_values": {
        "bonus": "NULL",
        "salary": "面议"
      },
      "list": {
        "category_param": "categoryId",
        "code_field": "Code",
        "count_path": "Count",
        "data_path": "Data",
        "page_param": "pageIndex",
        "page_size": 50,
        "post_id_field": "PostId",
        "posts_path": "Posts",
        "size_param": "pageSize",
        "success_value": 200,
        "timestamp_param": "timestamp"
      },
      "detail": {
        "code_field": "Code",
        "data_path": "Data",
        "success_value": 200,
        "timestamp_param": "timestamp"
      }
    },
    "list_api": {
      "url": "https://careers.tencent.com/tencentcareer/api/post/Query",
      "default_params": {
        "area": "cn",
        "attrId": "1",
        "bgIds": "",
        "cityId": "",
        "countryId": "",
        "keyword": "",
        "language": "zh-cn",
        "pageIndex": 1,
        "pageSize": 50,
        "parentCategoryId": "",
        "productId": ""
      }
    },
    "provider": "config",
    "throttle": {
      "max_retries": 3,
      "max_seconds": 1,
      "min_seconds": 0.5,
      "retry_backoff": 2,
      "timeout": 15
    }
  },
  {
    "_comment": "示例：复制此对象并修改即可快速接入新官网（演示配置，请勿删除或改动本示例）",
    "company_id": "CXXX",
    "company_name": "示例公司",
    "detail_api": {
      "url": "https://example.com/api/detail",
      "default_params": {
        "language": "zh-cn"
      }
    },
    "extra": {
      "default_category_id": "CXXXDEFAULT",
      "field_map": {
        "bonus": "detail.bonus",
        "description": "detail.description",
        "education": "detail.education",
        "job_url": "detail.url",
        "location": "detail.city",
        "publish_time": "detail.publish_time",
        "requirement": "detail.requirement",
        "salary": "detail.salary",
        "title": "detail.title",
        "work_experience": "detail.experience"
      },
      "default_values": {
        "bonus": "NULL",
        "salary": "面议"
      },
      "list": {
        "category_param": null,
        "code_field": "status.code",
        "count_path": "total",
        "data_path": "data",
        "page_param": "page",
        "page_size": 20,
        "post_id_field": "id",
        "posts_path": "items",
        "size_param": "pageSize",
        "success_value": 0,
        "timestamp_param": null
      },
      "detail": {
        "code_field": "status.code",
        "data_path": "data",
        "success_value": 0
      },
      "headers": {
        "Authorization": "Bearer <token>"
      }
    },
    "list_api": {
      "url": "https://example.com/api/list",
      "default_params": {
        "area": "cn",
        "categoryId": "",
        "cityId": "",
        "countryId": "",
        "language": "zh-cn",
        "pageIndex": 1,
        "pageSize": 20
      }
    },
    "provider": "config",
    "throttle": {
      "max_retries": 5,
      "max_seconds": 2,
      "min_seconds": 1,
      "retry_backoff": 1.5,
      "timeout": 20
    }
  }
]